{"benchmarkId":"chromatic-universe-v1","comparison":{"exactMatch":true},"evidenceTrail":[{"phase":"OBSERVE","request":{"type":"OBSERVE"},"response":{"observeIndex":1,"palette":["RED","GREEN","BLUE","YELLOW"],"type":"OBSERVATION"},"sequence":1},{"phase":"HYPOTHESIZE","request":{"hypothesis":{"candidateCount":6,"statement":"Exactly one unordered pair produces a non-default outcome; test every pair."},"type":"HYPOTHESIZE"},"sequence":2},{"evidenceRef":"evidence-0001","phase":"TEST","request":{"left":"RED","right":"GREEN","type":"TEST"},"response":{"evidenceRef":"evidence-0001","left":"RED","outcome":"NO_REACTION","right":"GREEN","testIndex":1,"type":"MEASUREMENT"},"sequence":3},{"phase":"REVISE","request":{"evidenceRefs":["evidence-0001"],"revision":{"specialPairFound":false,"testsCompleted":1},"type":"REVISE"},"sequence":4},{"evidenceRef":"evidence-0002","phase":"TEST","request":{"left":"RED","right":"BLUE","type":"TEST"},"response":{"evidenceRef":"evidence-0002","left":"RED","outcome":"NO_REACTION","right":"BLUE","testIndex":2,"type":"MEASUREMENT"},"sequence":5},{"phase":"REVISE","request":{"evidenceRefs":["evidence-0001","evidence-0002"],"revision":{"specialPairFound":false,"testsCompleted":2},"type":"REVISE"},"sequence":6},{"evidenceRef":"evidence-0003","phase":"TEST","request":{"left":"RED","right":"YELLOW","type":"TEST"},"response":{"evidenceRef":"evidence-0003","left":"RED","outcome":"NO_REACTION","right":"YELLOW","testIndex":3,"type":"MEASUREMENT"},"sequence":7},{"phase":"REVISE","request":{"evidenceRefs":["evidence-0001","evidence-0002","evidence-0003"],"revision":{"specialPairFound":false,"testsCompleted":3},"type":"REVISE"},"sequence":8},{"evidenceRef":"evidence-0004","phase":"TEST","request":{"left":"GREEN","right":"BLUE","type":"TEST"},"response":{"evidenceRef":"evidence-0004","left":"GREEN","outcome":"NO_REACTION","right":"BLUE","testIndex":4,"type":"MEASUREMENT"},"sequence":9},{"phase":"REVISE","request":{"evidenceRefs":["evidence-0001","evidence-0002","evidence-0003","evidence-0004"],"revision":{"specialPairFound":false,"testsCompleted":4},"type":"REVISE"},"sequence":10},{"evidenceRef":"evidence-0005","phase":"TEST","request":{"left":"GREEN","right":"YELLOW","type":"TEST"},"response":{"evidenceRef":"evidence-0005","left":"GREEN","outcome":"BLUE","right":"YELLOW","testIndex":5,"type":"MEASUREMENT"},"sequence":11},{"phase":"REVISE","request":{"evidenceRefs":["evidence-0001","evidence-0002","evidence-0003","evidence-0004","evidence-0005"],"revision":{"specialPairFound":true,"testsCompleted":5},"type":"REVISE"},"sequence":12},{"evidenceRef":"evidence-0006","phase":"TEST","request":{"left":"BLUE","right":"YELLOW","type":"TEST"},"response":{"evidenceRef":"evidence-0006","left":"BLUE","outcome":"NO_REACTION","right":"YELLOW","testIndex":6,"type":"MEASUREMENT"},"sequence":13},{"phase":"REVISE","request":{"evidenceRefs":["evidence-0001","evidence-0002","evidence-0003","evidence-0004","evidence-0005","evidence-0006"],"revision":{"specialPairFound":true,"testsCompleted":6},"type":"REVISE"},"sequence":14},{"phase":"CLAIM","request":{"rule":{"commutative":true,"defaultOutcome":"NO_REACTION","inputs":["GREEN","YELLOW"],"output":"BLUE","ruleType":"single-special-combination"},"type":"CLAIM"},"sequence":15}],"execution":{"networkMode":"DENIED","observeCount":1,"testCount":6},"finalClaimedRule":{"commutative":true,"defaultOutcome":"NO_REACTION","inputs":["GREEN","YELLOW"],"output":"BLUE","ruleType":"single-special-combination"},"groundTruthRule":{"commutative":true,"defaultOutcome":"NO_REACTION","inputs":["GREEN","YELLOW"],"output":"BLUE","ruleType":"single-special-combination"},"harnessVersion":"0.0.1","key":{"description":"Deterministic exhaustive protocol fixture; not a reference architecture or leaderboard entrant.","name":"kup-0.0.1-conformance-key","sourceRef":"keys/conformance_key.py"},"passed":true,"schemaVersion":"0.0.1","seed":17}
